Microsoft Windows [版本 10.0.17134.345]
(c) 2018 Microsoft Corporation。保留所有权利。

C:\WINDOWS\system32>net start mysql80
请求的服务已经启动。

请键入 NET HELPMSG 2182 以获得更多的帮助。


C:\WINDOWS\system32>mysql -u root -p
Enter password: ******
Welcome to the MySQL monitor.  Commands end with ; or \g.
Your MySQL connection id is 25
Server version: 8.0.12 MySQL Community Server - GPL

Copyright (c) 2000, 2018, Oracle and/or its affiliates. All rights reserved.

Oracle is a registered trademark of Oracle Corporation and/or its
affiliates. Other names may be trademarks of their respective
owners.

Type 'help;' or '\h' for help. Type '\c' to clear the current input statement.

mysql> show databases;
+--------------------+
| Database           |
+--------------------+
| fandaoai           |
| information_schema |
| mysql              |
| performance_schema |
| sys                |
| taobao             |
| taobao1            |
| taobao2            |
| zhabgwenjing1      |
+--------------------+
9 rows in set (0.00 sec)

mysql> use taobao;
Database changed
mysql> create table gwc(id int(11) primary key not null auto_increment,name varchar(20) not null,address varchar(20));
Query OK, 0 rows affected (0.35 sec)

mysql> desc taobao;
ERROR 1146 (42S02): Table 'taobao.taobao' doesn't exist
mysql> desc gwc;
+---------+-------------+------+-----+---------+----------------+
| Field   | Type        | Null | Key | Default | Extra          |
+---------+-------------+------+-----+---------+----------------+
| id      | int(11)     | NO   | PRI | NULL    | auto_increment |
| name    | varchar(20) | NO   |     | NULL    |                |
| address | varchar(20) | YES  |     | NULL    |                |
+---------+-------------+------+-----+---------+----------------+
3 rows in set (0.00 sec)

mysql> alter table gwc add xihuan varchar(1);
Query OK, 0 rows affected (0.42 sec)
Records: 0  Duplicates: 0  Warnings: 0

mysql> alter table gwc add zhekoutixing varchar(1);
Query OK, 0 rows affected (0.27 sec)
Records: 0  Duplicates: 0  Warnings: 0

mysql> alter table gwc add shuangshiyiyuanwang varchar(1);
Query OK, 0 rows affected (0.26 sec)
Records: 0  Duplicates: 0  Warnings: 0

mysql> desc gwc;
+---------------------+-------------+------+-----+---------+----------------+
| Field               | Type        | Null | Key | Default | Extra          |
+---------------------+-------------+------+-----+---------+----------------+
| id                  | int(11)     | NO   | PRI | NULL    | auto_increment |
| name                | varchar(20) | NO   |     | NULL    |                |
| address             | varchar(20) | YES  |     | NULL    |                |
| xihuan              | varchar(1)  | YES  |     | NULL    |                |
| zhekoutixing        | varchar(1)  | YES  |     | NULL    |                |
| shuangshiyiyuanwang | varchar(1)  | YES  |     | NULL    |                |
+---------------------+-------------+------+-----+---------+----------------+
6 rows in set (0.00 sec)

mysql> insert into gwc (id,name,address,xihuan,zhekoutixing,shuangshiyiyuanwang) value(1,"zwj","chifeng","1","1","1");
Query OK, 1 row affected (0.10 sec)

mysql> select * from gwc;
+----+------+---------+--------+--------------+---------------------+
| id | name | address | xihuan | zhekoutixing | shuangshiyiyuanwang |
+----+------+---------+--------+--------------+---------------------+
|  1 | zwj  | chifeng | 1      | 1            | 1                   |
+----+------+---------+--------+--------------+---------------------+
1 row in set (0.00 sec)

mysql> insert into gwc (id,name,address,xihuan,zhekoutixing,shuangshiyiyuanwang) value(2,"ch","chifeng","1","0","1"),(3,"mjn","tl","0","1","1"),(4,"hxj","ch","1","1","0");
Query OK, 3 rows affected (0.11 sec)
Records: 3  Duplicates: 0  Warnings: 0

mysql> select * from gwc;
+----+------+---------+--------+--------------+---------------------+
| id | name | address | xihuan | zhekoutixing | shuangshiyiyuanwang |
+----+------+---------+--------+--------------+---------------------+
|  1 | zwj  | chifeng | 1      | 1            | 1                   |
|  2 | ch   | chifeng | 1      | 0            | 1                   |
|  3 | mjn  | tl      | 0      | 1            | 1                   |
|  4 | hxj  | ch      | 1      | 1            | 0                   |
+----+------+---------+--------+--------------+---------------------+
4 rows in set (0.00 sec)

mysql> update gwc set shuangshiyiyuanwang=0 id=1;
ERROR 1064 (42000): You have an error in your SQL syntax; check the manual that corresponds to your MySQL server version for the right syntax to use near 'id=1' at line 1
mysql> update gwc set shuangshiyiyuanwang=0 where id=1;
Query OK, 1 row affected (0.11 sec)
Rows matched: 1  Changed: 1  Warnings: 0

mysql> select * from gwc;
+----+------+---------+--------+--------------+---------------------+
| id | name | address | xihuan | zhekoutixing | shuangshiyiyuanwang |
+----+------+---------+--------+--------------+---------------------+
|  1 | zwj  | chifeng | 1      | 1            | 0                   |
|  2 | ch   | chifeng | 1      | 0            | 1                   |
|  3 | mjn  | tl      | 0      | 1            | 1                   |
|  4 | hxj  | ch      | 1      | 1            | 0                   |
+----+------+---------+--------+--------------+---------------------+
4 rows in set (0.00 sec)
mysql> alter table gwc add iddelete varchar(1) not null;
Query OK, 0 rows affected (0.33 sec)
Records: 0  Duplicates: 0  Warnings: 0

mysql> select * from gwc;
+----+------+---------+--------+--------------+---------------------+----------+
| id | name | address | xihuan | zhekoutixing | shuangshiyiyuanwang | iddelete |
+----+------+---------+--------+--------------+---------------------+----------+
|  1 | zwj  | chifeng | 1      | 1            | 0                   |          |
|  2 | ch   | chifeng | 1      | 0            | 1                   |          |
|  3 | mjn  | tl      | 0      | 1            | 1                   |          |
|  4 | hxj  | ch      | 1      | 1            | 0                   |          |
+----+------+---------+--------+--------------+---------------------+----------+
4 rows in set (0.00 sec)

mysql> update gwc set iddelete=0 where id=3;
Query OK, 1 row affected (0.14 sec)
Rows matched: 1  Changed: 1  Warnings: 0

mysql> select * from gwc;
+----+------+---------+--------+--------------+---------------------+----------+
| id | name | address | xihuan | zhekoutixing | shuangshiyiyuanwang | iddelete |
+----+------+---------+--------+--------------+---------------------+----------+
|  1 | zwj  | chifeng | 1      | 1            | 0                   |          |
|  2 | ch   | chifeng | 1      | 0            | 1                   |          |
|  3 | mjn  | tl      | 0      | 1            | 1                   | 0        |
|  4 | hxj  | ch      | 1      | 1            | 0                   |          |
+----+------+---------+--------+--------------+---------------------+----------+
4 rows in set (0.00 sec)